"conversation_id_str","created_at","favorite_count","full_text","id_str","image_url","in_reply_to_screen_name","lang","location","quote_count","reply_count","retweet_count","tweet_url","user_id_str","username"
"1795331918118207580","Tue May 28 05:50:59 +0000 2024","4"," tmn gue akunnya dipake pinjol sm tmnnya dan dia skrg dikejar kejar pinjol. dia ngemis2 minta ditalangi buat bulan ini tapi tmn gue ini pernah pinjem di gua 400rb ga dibalikin. jujur gue udh nolak tp dia maksa trs sampe skrg https://t.co/nPsj880SO6","1795331918118207580","https://pbs.twimg.com/media/GOpM3QDbYAAJVx6.jpg","","in","Indonesia","1","7","1","https://x.com/tanyarlfes/status/1795331918118207580","1371650588","tanyarlfes"
"1797385785081278927","Sun Jun 02 21:52:19 +0000 2024","30396","JANGAN PERNAH PINJEMIN ATAU AMBIL PINJOL UNTUK ORANG LAIN!! Gue akuin gue bodoh cuma karena rasa hutang budi. Gue jadi susah sendiri sekarang. Mungkin kalo ada yang kenal bisa tolong bantu tagihin. Gue diblokir semua soalnya.","1797385785081278927","","","in","TGR-JKT-CRB","835","287","5750","https://x.com/_anakpolos/status/1797385785081278927","2445871479","_anakpolos"
"1797425375125061751","Mon Jun 03 00:29:38 +0000 2024","2","Pantesan orang2 demen ngutang ke pinjol Ada jokinya kalo galbay https://t.co/rZyOX9jUyp","1797425375125061751","https://pbs.twimg.com/media/GPG82WMa8AAcbW_.jpg","","in","","0","4","1","https://x.com/15DEATH/status/1797425375125061751","81755703","15DEATH"
"1797562340717850761","Mon Jun 03 09:33:53 +0000 2024","6748","gw nggak ngerokok ga miras ga pinjol ga judol. udah ya bebas aja dong duit gw mau dipake apa.","1797562340717850761","","","in","Jakarta, Indonesia","25","53","2919","https://x.com/kotakmakan/status/1797562340717850761","19333068","kotakmakan"
"1705117606771052620","Fri Sep 22 07:11:31 +0000 2023","5019","RT KERAS!! Tantangan pada @kurawa dan gerombolannnya! Kami bisa menemukan keluarga korban bunuh diri atas teror DC pinjol tsb asal dia atau @adakamiofficial bersedia mengganti rugi 20 miliar atas kehilangan nyawa kepala keluarga mereka! Cc: @Heraloebss https://t.co/G75ID71gO4","1705117606771052620","https://pbs.twimg.com/media/F6nLbVBbcAApuLo.jpg","","in","Indonesia","76","528","1874","https://x.com/PartaiSocmed/status/1705117606771052620","869327120","PartaiSocmed"
"1796767355978297514","Sat Jun 01 04:54:54 +0000 2024","745","Sekedar info hati-hati penipuan baru lagi pencuri data anda dan digunakan untuk transaksi pinjol Penjelasan nya ada di tread https://t.co/srblmcTZ9W","1796767355978297514","https://pbs.twimg.com/media/GO9mY2ZbQAAr6sQ.jpg","","in","Bukit Kecil, Indonesia","5","2","101","https://x.com/Random_com88/status/1796767355978297514","1728447783844356096","Random_com88"
"1796770886349140385","Sat Jun 01 05:08:56 +0000 2024","2","Hallo selamat siang izin share min","1796770886349140385","","","in","","0","0","0","https://x.com/Aditya_Candraaa/status/1796770886349140385","1323915647730946048","Aditya_Candraaa"
"1796475646585217125","Fri May 31 09:35:45 +0000 2024","7","Yang abis hartanya habis sama pinjol itu bukan kaum menengah ke bawah tapi menengah ke atas. Ketika kamu punya pinjol percayalah status sosialmu yang sedang berada di atas akan hilang. Uangmu gajimu asetmu semuanya akan hilang. Bahkan rumah tanggamu bisa hancur. Total https://t.co/M58L6BB7hV","1796475646585217125","https://pbs.twimg.com/media/GO5dEugbIAA2yl3.jpg","","in","Bandung, Jawa Barat","0","1","3","https://x.com/solusipinjoll/status/1796475646585217125","1382794203432853507","solusipinjoll"
"1797613645368828117","Mon Jun 03 12:57:45 +0000 2024","4","kalau gw makin gendut salahin rsj ya thank you buat pinjol favoriteku @awreennz_ @ddummyxx @preetypei @bangtanbotakkkk @cestzhei_ @yourndu @wIeowIeow https://t.co/h7ddsfdTbE","1797613645368828117","https://pbs.twimg.com/media/GPJoE_CbkAABYlc.jpg","","in","di angan-angan","0","4","0","https://x.com/issantejane/status/1797613645368828117","2956526712","issantejane"
"1798145664649711920","Wed Jun 05 00:11:49 +0000 2024","15","uyah ya asin om BPJS BAYAR 2JT TAPERA LISTRIK PINJOL JOKOWI LUHUT PBNU MUHAMMADIYAH https://t.co/o9QG677D8R","1798145664649711920","https://pbs.twimg.com/ext_tw_video_thumb/1798145334113337344/pu/img/YUUwZcVbP0u25uF0.jpg","","in","Semarang, Jawa Tengah","0","2","1","https://x.com/caepriecrxn_/status/1798145664649711920","1378911463436288000","caepriecrxn_"
"1796051288955801877","Thu May 30 05:29:30 +0000 2024","15","Akhirnya perhutangan ini beres semua Dengan masih bayarin 6-7jtan di 3-4 bulan terakhir.. Terima kasih ya masa lalu sudah mengajarkan ku buat ga terlalu banyak berbuat baik pada orang lain apalagi minjemin akun pinjol https://t.co/PLnraaDmcl","1796051288955801877","https://pbs.twimg.com/media/GOzbH7ma4AACbD0.jpg","","in","","0","11","2","https://x.com/kenalinakuken/status/1796051288955801877","1434421719805034503","kenalinakuken"
"1797908006795108593","Tue Jun 04 08:27:26 +0000 2024","2","hidup ancur garagara pinjol gustii ","1797908006795108593","","","in","","0","0","0","https://x.com/thisischeese__/status/1797908006795108593","1605527441195536384","thisischeese__"
"1798137260174631305","Tue Jun 04 23:38:25 +0000 2024","11","Bea Cukai Ajak Para Calon PMI Pahami Peraturan Kepabeanan Hal ini perlu dilakukan sebagai bekal ilmu agar para calon PMI nantinya lancar bepergian lintas negara. negaranya dan tidak kehilangan fasilitas yang menjadi haknya. Bayar 2jt Mbappe Luhut Pinjol #Gajike13Cair Sumatera https://t.co/sfhTdQtjkP","1798137260174631305","https://pbs.twimg.com/media/GPRETrhaQAAIU57.jpg","","in","DKI Jakarta, Indonesia","2","1","9","https://x.com/rasa2086/status/1798137260174631305","1290494259791933443","rasa2086"
"1798128714892681671","Tue Jun 04 23:04:27 +0000 2024","11","Tim gabungan Bea Cukai menggagalkan penyeludupan 15 9 juta batang rokok ilegal atau yang tidak dilekati pita cukai dalam dua operasi penindakan terpisah di perairan Provinsi Aceh. Bayar 2jt Mbappe Luhut Pinjol #Gajike13Cair Sumatera Innalillahi https://t.co/Mnknd1AZhW","1798128714892681671","https://pbs.twimg.com/media/GPQ8iWXaEAAdKkJ.jpg","","in","","1","1","9","https://x.com/Nidyna10/status/1798128714892681671","1710309382293004288","Nidyna10"
"1797908948319875391","Tue Jun 04 08:31:11 +0000 2024","4","Mau modal usaha? 1. Simak dulu videonya sampai abis 2. Daftar pinjol sebanyak-banyak. 3. Ambil semua pinjaman yang tidak berbunga sesuaikan dengan tanggal jatuh temponya. Selamat mencoba dan percayalah ga akan masuk penjara. https://t.co/tYX75KM4is","1797908948319875391","https://pbs.twimg.com/ext_tw_video_thumb/1797908765829918720/pu/img/mFnKQ8Jm6bZYk265.jpg","","in","ÜT: 6.307611,6.744946","0","0","0","https://x.com/ethadisaputra/status/1797908948319875391","55300590","ethadisaputra"
"1798150392389476807","Wed Jun 05 00:30:36 +0000 2024","13","Menteri Perhubungan (Menhub) Budi Karya Sumadi mengatakan pembangunan jalan yang juga merupakan jalur kereta otonom tanpa rel atau Autonomous Rail Transit (ART) di Ibu Kota Negara (IKN) Nusantara telah selesai. ___ Bayar 2jt Mbappe Luhut Pinjol #Gajike13Cair Sumatera Innalillahi https://t.co/wF4hALbI8b","1798150392389476807","https://pbs.twimg.com/media/GPRQQH9aIAAOsI-.jpg","","in","Indonesia","2","2","11","https://x.com/Saodah1234/status/1798150392389476807","1272953532535062529","Saodah1234"
"1698673197619847574","Mon Sep 04 12:23:44 +0000 2023","6004","- Gak terima dibilang miskin ilmu tapi kalau debat bisanya ngatain fisik orang - Mahasiswa tapi matematika dasar level anak SD aja gak paham - Nulis skripsi pakai joki tapi paling ngamuk kalau diledekin SDM rendah - Guru digaji sangat kecil sampai banyak yang terjerat pinjol https://t.co/zaWiZ5N8rz","1698673197619847574","https://pbs.twimg.com/media/F5LmH9TaAAAMifY.jpg","","in","","456","343","1926","https://x.com/JennyJusuf/status/1698673197619847574","28747261","JennyJusuf"
"1681658179430805505","Wed Jul 19 13:32:08 +0000 2023","22729","Indonesia itu surganya penipuan online Hari ini nyokap temen gue kena tipu 480 juta dari online terus anak kantor gue ada yang datanya dipake buat pinjol sama orang lain Kayaknya penipuan online ini susah banget ya diusut sampe makin hari makin menjamur","1681658179430805505","","","in","jalansantai@gmail.com","512","844","4727","https://x.com/ridwanhr/status/1681658179430805505","43922847","ridwanhr"
"1798128339787673781","Tue Jun 04 23:02:58 +0000 2024","10","Plt Kepala OIKN Nusantara Basuki Hadimuljono buka suara soal 2.086 hektare lahan yang masih bermasalah di IKN. Basuki akan segera menyelesaikan persoalan tsb dengan mengutamakan kepentingan rakyat. Bayar 2jt Mbappe Luhut Pinjol #Gajike13Cair Sumatera Innalillahi https://t.co/FGfu9ZbCzf","1798128339787673781","https://pbs.twimg.com/media/GPQ8MiPa8AAbnhX.jpg","","in","","0","4","11","https://x.com/Nidyna10/status/1798128339787673781","1710309382293004288","Nidyna10"
"1796083640205467858","Thu May 30 07:38:04 +0000 2024","3","Yuhuuuu cair lagi wangi nih yang udh pusing galub tulob bayar tagihan spaylater spinjam kredivo akulaku mending pake #jokipinjol manfaatin pinjol semilegal dan illegal nya tagihan nya ga perku dibayar lagi beb biar gak pusing #zonauang https://t.co/zcl9jyhXS9","1796083640205467858","https://pbs.twimg.com/media/GOz4jGSawAAYFto.jpg","","in","Her public note","0","1","1","https://x.com/rebibillyhills/status/1796083640205467858","1486223228435853319","rebibillyhills"
"1796001675527770200","Thu May 30 02:12:22 +0000 2024","4","Kami dpat laporan dari pengikut saya mengenai teror yang di duga dri pinjol pinjam duit. Apakah teror pinjol legal di biarkan yang benar benar meresahkan. Saya pun sndiri lbh baik milih galbay ketimbang di bayar !! @ojkindonesia @OfficialAfpi https://t.co/PtkKAlWd4w","1796001675527770200","https://pbs.twimg.com/media/GOyuAMrbwAAI7lK.jpg","","in","Jakarta Pusat, DKI Jakarta","0","1","2","https://x.com/angela_pangestu/status/1796001675527770200","1502030198157447181","angela_pangestu"
"1797612257813381556","Mon Jun 03 12:52:14 +0000 2024","290","Ga dibayar 11 bulan. Klo kepala IKN sih bisa bertahan hidup krn banyak tabungan. Lha pegawai yg di bawah gmn cara bertahan hidup? Pinjol? https://t.co/Evp615kQ0B","1797612257813381556","https://pbs.twimg.com/ext_tw_video_thumb/1797610038233911297/pu/img/yQGhb7wmnXycLhpX.jpg","","in","Indonesia","5","23","55","https://x.com/narkosun/status/1797612257813381556","84221579","narkosun"
"1717142313573777723","Wed Oct 25 11:33:25 +0000 2023","10371","Kita sering dengar cerita petani gak bisa nabung masih utang sana-sini sampe terjerat pinjol untuk beli pupuk. Boro-boro mikir anak kuliah SPP sekolah dasar aja susah. Ketika harga pangan naik tak satupun petani menikmatinya. Mereka justru tambah sengsara karena pemerintah https://t.co/t5aJSHJNq3","1717142313573777723","https://pbs.twimg.com/amplify_video_thumb/1717131786453684224/img/qTPC348y45Dhmeke.jpg","","in","Indonesia","316","6665","4714","https://x.com/cakimiNOW/status/1717142313573777723","1490116879","cakimiNOW"
"1795456351222517999","Tue May 28 14:05:26 +0000 2024","5","Penyumbang terbesar persentase korban pinjol berprofesi guru. Perlu diteliti dan dikaji ulang sih sepertinya kenapa bisa begitu. 42% yg mana hampir setengah dari total 100% @Kemdikbud_RI @jokowi @prabowo https://t.co/AQqyVo3JHp","1795456351222517999","https://pbs.twimg.com/media/GOq-B5vWcAA5UyI.jpg","","in","","0","4","1","https://x.com/SamaPinjol/status/1795456351222517999","1696363956007522304","SamaPinjol"
"1798200446252953913","Wed Jun 05 03:49:29 +0000 2024","2","Kasus Naik Penyidikan Suami BCL Tiko Aryawardhana Terancam Jadi Tersangka Penipuan Rp 6 9 M SELENGKAPNYA =&gt; https://t.co/mb40bX0yyq Mencekam #PromoGuncang Bayar 2jt #LiaChat Listrik Kalimantan #GajiKe13Cair Pinjol PDIP Muhammadiyah https://t.co/sIekuZp5OY","1798200446252953913","https://pbs.twimg.com/media/GPR9xWHaIAAoyAf.jpg","","in","Jl Sungai Raya Dalam Kubu Raya","0","1","0","https://x.com/tribunpontianak/status/1798200446252953913","115936810","tribunpontianak"
"1798130240411324542","Tue Jun 04 23:10:31 +0000 2024","12","Kapendam XVII Cenderawasih Letkol Inf Candra Kurniawan merespons masifnya serangan OPM dgn sasaran warga sipil. Kelompok bersenjata ini berdalih dgn menarasikan korbannya merupakan apkam di media sosial padahal warga sipil. #TumpasKSTPelanggarHAM Bayar 2jt Mbappe Luhut Pinjol https://t.co/wC3KxbBZyG","1798130240411324542","https://pbs.twimg.com/ext_tw_video_thumb/1798130113047154688/pu/img/7VAJbOuVaH2NqtS2.jpg","","in","","1","4","11","https://x.com/Nidyna10/status/1798130240411324542","1710309382293004288","Nidyna10"
"1703970846497497418","Tue Sep 19 03:14:42 +0000 2023","9096","Hallo @ojkindonesia. Kami dapat banyak sekali pengaduan tentang pinjol @adakamiofficial yg dipimpin oleh Bernardino Moningka Vega. Baik berupa praktek bunga terselubung hingga mendekati 100% hingga cara2 penagihan meneror ke kantor dan serangan order gofood palsu. https://t.co/7PDkIGu440","1703970846497497418","https://pbs.twimg.com/media/F6W4dFOa4AAz_Tp.jpg","","in","Indonesia","339","865","3617","https://x.com/PartaiSocmed/status/1703970846497497418","869327120","PartaiSocmed"
"1429624837186547713","Mon Aug 23 02:01:36 +0000 2021","3845","Fix Indonesia terjerat pinjol. https://t.co/AVoMUENqQr","1429624837186547713","","","in","Cipayung, Indonesia","116","336","1194","https://x.com/NOTASLIMBOY/status/1429624837186547713","19190361","NOTASLIMBOY"
"1795597235989934137","Tue May 28 23:25:16 +0000 2024","2240","Akan selalu bangga menceritakan masa-masa ini Mei 2022 - Nov 2023. Diagnosa B20 resign kerjaan dengan posisi hutang pinjol belasan juta bisnis ortu failed karena harus ngurus aku rumah tangga berantakan hubungan sama mamah jadi renggang financial keluarga ancur even buat.. https://t.co/G6uX4d9Jcl","1795597235989934137","https://pbs.twimg.com/media/GOs-KepaMAAXN0_.jpg","","in","D","24","71","249","https://x.com/500HumanError/status/1795597235989934137","1764515916862332928","500HumanError"
"1705563920038285723","Sat Sep 23 12:45:01 +0000 2023","15112"," tetanggaku gil4 bngt. dia kelilit pinjol trs dia mau minjem surat² motorku(trs ak bilang kalo surat² nya di simpen ayahku) dia jg maksa pinjem ktp ku untung ak blm punya ktp. gtw putus asa atau gimana dia pindah tetangga sebelah buat pinjem sertifikat tanah","1705563920038285723","","","in","Indonesia","203","499","540","https://x.com/tanyakanrl/status/1705563920038285723","1331650559518990336","tanyakanrl"
"1796320066512003434","Thu May 30 23:17:32 +0000 2024","4","Restrukturisasi EC Easy cash kl doc dilengkapin diatuh 100% acc restrukturisasi kok cung yang udh pada restrukturisasi di EasyCash merapat https://t.co/PL661LQzcq","1796320066512003434","https://pbs.twimg.com/media/GO3PknoboAAXOX0.jpg","","in","","1","1","0","https://x.com/bstgirlfriend/status/1796320066512003434","1764244003346882560","bstgirlfriend"
"1798145130157031527","Wed Jun 05 00:09:41 +0000 2024","12","Menjelang Pilkada Serentak 2024 KPU berkomitmen untuk menjamin transparansi data Pilkada dan membentuk PPS yang berkualitas agar Pilkada Serentak 2024 lancar dan sukses Bayar 2jt Mbappe Luhut Pinjol #Gajike13Cair Sumatera Innalillahi https://t.co/PLyEN0JlHt","1798145130157031527","https://pbs.twimg.com/media/GPRLdbMasAA3him.jpg","","in","Bandung, Indonesia","2","2","10","https://x.com/septixtang/status/1798145130157031527","1334156528174022659","septixtang"
"1798100566293533001","Tue Jun 04 21:12:36 +0000 2024","4","Pinjol emang cara instan untuk mendapatkan uang. Dan karena kesulitan ekonomi banyak rakyat di negeri ini yg terjerat pinjol. Belum lagi banyak rakyat yg berhalusinasi untuk mendapatkan uang banyak lewat judi online. Seperti ada legalisasi untuk menyengsarakan rakyat. Gawat.","1798100566293533001","","","in","Bumiayu, Indonesia","2","0","1","https://x.com/sukardiyahya162/status/1798100566293533001","1539724674749579265","sukardiyahya162"
"1797797287764299834","Tue Jun 04 01:07:29 +0000 2024","41","Manifesting hari ini juga banyak cust wangi dan gak ribet #zonauang","1797797287764299834","","","in","Her public note","1","3","25","https://x.com/rebibillyhills/status/1797797287764299834","1486223228435853319","rebibillyhills"
"1711216279443382355","Mon Oct 09 03:05:28 +0000 2023","8114","sumpah kalo kalian liat thread orang yang gagal bayar pinjol itu di replynya banyak banget yang kasusnya sama dan dengan sengaja meng-gagal bayarkan pinjol2nya mereka tuh kayak sangat amat gak bertanggung jawab jir ","1711216279443382355","","","in","","202","299","844","https://x.com/malameze/status/1711216279443382355","1090067662749585408","malameze"
"1798137045896044646","Tue Jun 04 23:37:34 +0000 2024","11","Proyek Bandara IKN Dikebut 1 Agustus Sudah Beroperasi Menhub Budi Karya Sumadi mengatakan progres pembangunan di dua lokasi ini dan sejumlah fasilitas lainnya secara garis besar sudah baik dan sesuai rencana. Bayar 2jt Mbappe Luhut Pinjol #Gajike13Cair Sumatera Innalillahi https://t.co/oAeM7SIGaX","1798137045896044646","https://pbs.twimg.com/media/GPREHTnaIAEzbd3.jpg","","in","DKI Jakarta, Indonesia","3","2","9","https://x.com/rasa2086/status/1798137045896044646","1290494259791933443","rasa2086"
"1798135367113363496","Tue Jun 04 23:30:53 +0000 2024","9","RI Siap Kirim Pasukan Perdamaian Di Gaza Menlu Retno juga menyebut langkah pengiriman pasukan bisa terjadi jika gencatan senjata terwujud secara jelas antara kedua pihak. Bayar 2jt Mbappe Luhut Pinjol #Gajike13Cair Sumatera Innalillahi https://t.co/fed8XSp9Yu","1798135367113363496","https://pbs.twimg.com/media/GPRCljkbMAAAerm.jpg","","in","Indonesian","1","2","9","https://x.com/Clara_Shinta99/status/1798135367113363496","322559270","Clara_Shinta99"
"1797932387374104653","Tue Jun 04 10:04:19 +0000 2024","107","Bunganya ngalah-ngalahin pinjol https://t.co/ANZuforEil","1797932387374104653","https://pbs.twimg.com/ext_tw_video_thumb/1797932366968860672/pu/img/DEQntOHAp2oD11hg.jpg","","in","","0","103","2","https://x.com/anoonamu/status/1797932387374104653","1735965775960367104","anoonamu"
"1798149486952468481","Wed Jun 05 00:27:00 +0000 2024","15","Pemerintah terus mengebut pembangunan bandara Ibu Kota Nusantara (IKN). Targetnya bandara ini rampung sekaligus beroperasi pada 1 Agustus 2024 mendatang. ___ Bayar 2jt Mbappe Luhut Pinjol #Gajike13Cair Sumatera Innalillahi https://t.co/yphenPTaef","1798149486952468481","https://pbs.twimg.com/media/GPRPbb6bkAAzi0v.jpg","","in","Indonesia","3","2","11","https://x.com/Saodah1234/status/1798149486952468481","1272953532535062529","Saodah1234"
"1536653537869828101","Tue Jun 14 10:15:27 +0000 2022","4974","Cara bisnis @IndiHome sangat tidak etis. @TelkomCare Scr sepihak tanpa pengetahuan pelanggan aktifkan minipack IndiJowo &amp; bebankan beaya kpd pelanggan Ketika saya minta dihentikan syaratnya harus unggah KTP &amp; foto selfie bawa KTP macam orang mau utang pinjol Dimana etikanya? https://t.co/xu1coCGmZB","1536653537869828101","https://pbs.twimg.com/media/FVNKPs0VEAA2zAn.jpg","","in","Jakarta, Indonesia","233","538","2089","https://x.com/alvinlie21/status/1536653537869828101","30648872","alvinlie21"
"1796640492542886148","Fri May 31 20:30:48 +0000 2024","3","diandra paramitha kl lu liat ini gw gapeduli sbnrnya sm uang gw yg lu bawa kabur. gw cm ksian sm keluarga lu yg dipake identitasnya buat lu pinjol anjing emg jadi anak gatau diri banget","1796640492542886148","","","in","","0","0","0","https://x.com/payayie/status/1796640492542886148","1160471919935647744","payayie"
"1718304773102006464","Sat Oct 28 16:32:37 +0000 2023","6062","#intinyadeh suami selingkuh. Ketauan dr gmaps suka ke apart dkt kantor. Tinggal dan makan di mertua gapernah ngasih mertua ngasih Istri 1jt/bulan minjem pinjol 16jt a.n istri. Tp sering transfer ke selingkuhan. Pas kel. suami tau istri diceramahin katanya krg perhatian.","1718304773102006464","","","in","di ujung lidah tapi gak keluar","398","296","1014","https://x.com/intinyadeh/status/1718304773102006464","1525880650829467648","intinyadeh"
"1601610849210494976","Sat Dec 10 16:12:37 +0000 2022","8044","model iklan pinjol kenapa gapernah ada yang cakep ya","1601610849210494976","","","in","Indonesia","152","350","1684","https://x.com/DesignRant2/status/1601610849210494976","1330353927355834369","DesignRant2"
"1795667597188530424","Wed May 29 04:04:51 +0000 2024","41","Hasil riset dari @ideas_riset @dompetdhuafaorg dan great edunesia Hal yang unik mimin temui dimana hanya 5% guru menjadi klien pinjol namun secara jumlah 42% klien pinjol adalah guru . Ini rasio besar . Ada 20% guru tidak memiliki hutang Namun 10% guru memiliki uang lebih https://t.co/W2tM6tforP","1795667597188530424","https://pbs.twimg.com/media/GOt-JwhaEAAZ3Ht.jpg","","in","","0","1","13","https://x.com/pppkguru/status/1795667597188530424","1498383122571751427","pppkguru"
"1797500343821218033","Mon Jun 03 05:27:32 +0000 2024","10","Karena cust ku baik-baik hari ini dan gercep bayar fee aku mau giveaway Saldo All E-wallet 30k buat 2 orang pemenang. Rules : Follow aku + comment di post ini End besok jam 3 sore!! Semoga beruntung #zonauang #giveaway","1797500343821218033","","","in","Her public note","1","62","38","https://x.com/rebibillyhills/status/1797500343821218033","1486223228435853319","rebibillyhills"
"1795727844523565161","Wed May 29 08:04:15 +0000 2024","5","sebenernya sikap cuek para pemain pinjol yang bikin para DC jadi was was. gmn ga was was. nasabah ga bayar yah DC ga dapet bonus. bisa bisa di cut off","1795727844523565161","","","in","","0","1","2","https://x.com/BeritaPinjol/status/1795727844523565161","1690313292974379008","BeritaPinjol"
"1797627205167841620","Mon Jun 03 13:51:38 +0000 2024","23","Hindari judol dan pinjol untuk hidup yg lebih tenang ","1797627205167841620","","","in","","0","6","0","https://x.com/aulianiwidya/status/1797627205167841620","1197698549867143168","aulianiwidya"
"1796901934240260258","Sat Jun 01 14:44:30 +0000 2024","2","@esmosibuanget Tos Samaan kita jajan seblak td biar seger kepala akhir bulan kmrn Jatah bulanan pada lari ke pinjol mana akhir bulan lg masih lama https://t.co/KceG6bCBGV","1796915732837810676","https://pbs.twimg.com/media/GO_tVeSbEAA0-NR.jpg","esmosibuanget","in","","0","1","0","https://x.com/bstgirlfriend/status/1796915732837810676","1764244003346882560","bstgirlfriend"
"1797567258434412788","Mon Jun 03 09:53:26 +0000 2024","2","Sesuai dengan yang gw pikirkan Kalian2 yang sudah kasih alamat dan nomor WA kalo sampai terjadi hal kayak begini bagaimana....? Alamat dan nomor kalian dijadikan kontak darurat untuk pinjol atau apapun itu..lalu kalian yang akan repot karena gak tau apa2 https://t.co/rNUEmpNKVz","1797567258434412788","https://pbs.twimg.com/media/GPI9i7_awAA0do0.png","","in","","1","0","0","https://x.com/jimmies_again/status/1797567258434412788","2924154001","jimmies_again"
"1797416563932627423","Sun Jun 02 23:54:39 +0000 2024","62","Maaf kalo berantakan. Jadi tahun lalu tante gue ngehubungin gue mau pinjem uang 20an juta. Katanya buat bayar kuliah anaknya dan bantu biaya² yg diperluin untuk anaknya yg lain koas. Karena gue ga ada uang lagi buntu dan ngerasa ada utang budi. Jadi gue nekat tawarin pinjol https://t.co/rK8h9zPXVK","1797416569234153698","https://pbs.twimg.com/media/GPGwzbvasAAHMeQ.jpg","_anakpolos","in","TGR-JKT-CRB","1","5","9","https://x.com/_anakpolos/status/1797416569234153698","2445871479","_anakpolos"
"1391471455766925313","Sun May 09 19:13:42 +0000 2021","34007","Kalo gua nanti punya anak cewek terus pacarnya dateng ngapel gua suruh foto sambil megang ktp terus gua bisikin sampe anak gua kenapa kenapa gua jadiin jaminan pinjol ","1391471455766925313","","","in","","1641","700","10428","https://x.com/ardianpancaa/status/1391471455766925313","110090649","ardianpancaa"
"1797544439059218639","Mon Jun 03 08:22:45 +0000 2024","76","Siapa yg klo lg nyetir suka bengong? Mikirin bayar cicilan Innova. Mikirin bayar cicilan Nmax. Mikirin bayar pinjol. Mikirin gaji di potong tapera. Mikirin MA kok bisa ngerubah syarat minimal umur calon kepala daerah. https://t.co/izSsGHMZyW","1797544439059218639","https://pbs.twimg.com/ext_tw_video_thumb/1797544409493606400/pu/img/m-G66zlR8QnFHKLf.jpg","","in","Jakarta Capital Region, Indone","3","15","17","https://x.com/innovacommunity/status/1797544439059218639","1466179188096913412","innovacommunity"
"1417778936356818947","Wed Jul 21 09:30:14 +0000 2021","21293","Absurd bgt di kantor ada yg gajinya 20jt hapenya redmi santai2 aja yg gajinya 3jt maksa nyicil iphone 12 sampe skrg kelilit pinjol. I guess frugal living is not for everyone?","1417778936356818947","","","in","Tarrey Town","1378","692","6002","https://x.com/ribonk/status/1417778936356818947","94822365","ribonk"
"1795254871152841186","Tue May 28 00:44:50 +0000 2024","12","Masuk ga? #zonauang","1795254871152841186","","","in","start 08:00 - sleep💤","0","0","0","https://x.com/bnrbgt/status/1795254871152841186","1616271314578460673","bnrbgt"
"1798129240640307639","Tue Jun 04 23:06:33 +0000 2024","10","Kapendam XVII/Cenderawasih Letkol Inf Candra Kurniawan mengatakan warga sipil atas nama Zainul yg ditembak mati OPM di Puncak Jaya bukan anggota TNI. Tidak benar Prajurit TNI ditembak mati oleh OPM di Mulia Kab Puncak Jaya #TumpasKSTPelanggarHAM Bayar 2jt Mbappe Luhut Pinjol https://t.co/duET5UcqlE","1798129240640307639","https://pbs.twimg.com/media/GPQ9Az-aQAAEAOt.jpg","","in","","0","4","10","https://x.com/Nidyna10/status/1798129240640307639","1710309382293004288","Nidyna10"
"1797224830410100736","Sun Jun 02 11:12:50 +0000 2024","5","Selain uatas aplikasi yang sama dari segi tenor dan teror adalah BANTUSAKU FiNPLUS PINJAMYUK. dan masih banyak apps lainya.","1797224852077863320","","solusipinjoll","in","Bandung, Jawa Barat","1","1","0","https://x.com/solusipinjoll/status/1797224852077863320","1382794203432853507","solusipinjoll"
