"conversation_id_str","created_at","favorite_count","full_text","id_str","image_url","in_reply_to_screen_name","lang","location","quote_count","reply_count","retweet_count","tweet_url","user_id_str","username"
"1797477860879577375","Mon Jun 03 03:58:12 +0000 2024","16","dana diterima cuma 15jt tapi bunganya EDAAAANN total selama 17bulan kalau perbulannya 1.6 sekian tuh gue totalin sekitar segini anzingggg wkwkwk capek bangetttt emg pinjol pinjol itu https://t.co/9nDYI7n4QB","1797477860879577375","https://pbs.twimg.com/media/GPHsleUbQAEJLi2.jpg","","in","","0","4","3","https://x.com/kittenclaay/status/1797477860879577375","335116442","kittenclaay"
"1797895493449916714","Tue Jun 04 07:59:13 +0000 2024","5","@tanyarlfes ini bukan es teh tapi ES TEH","1797900903372267938","","tanyarlfes","in","","0","0","0","https://x.com/solpinmu/status/1797900903372267938","1660840124031332352","solpinmu"
"1797434475812729184","Mon Jun 03 01:05:48 +0000 2024","4","Mowning!! Manifesting hari ini cust ku wangi wangi dan tidak ribet #zonauang","1797434475812729184","","","in","Her public note","0","0","9","https://x.com/rebibillyhills/status/1797434475812729184","1486223228435853319","rebibillyhills"
"1770457483179672003","Thu May 30 17:38:04 +0000 2024","3","Apk pinjol apa ajasih yg bs kasih keringan restrukturisasi? EC pinyuk uatas pindu adamodal monas klikkami cairin samir winwin bansak fin+ ivoji uku rucep (by pengalaman pribadi + bantuin)","1796234638735942021","","bstgirlfriend","in","","0","0","0","https://x.com/bstgirlfriend/status/1796234638735942021","1764244003346882560","bstgirlfriend"
"1795678971885146511","Wed May 29 04:50:03 +0000 2024","16","Ilustrasi terjebak masalah hutang/pinjol/paylater : Punya celah cuma buat nafas aja udh Alhamdulillah https://t.co/YUcZfyTGC7","1795678971885146511","https://pbs.twimg.com/ext_tw_video_thumb/1795678922430173184/pu/img/kqhd9LN4CQHzbj-E.jpg","","in","Indonesia","0","0","2","https://x.com/richvyyy/status/1795678971885146511","1248068588545572864","richvyyy"
"1797881619287863711","Tue Jun 04 13:57:28 +0000 2024","4","@kumparan ini indofarma TBK harus belajar dari kementan jadi bisa WTP tapi bung @erickthohir masih pesam - pesem ae tuhhh lebih nyibukkan ke bola‼️ehhh bumn nya makin ancurrrrr kinerja nya‼️ haeduhhhh !!!! koq ya bisa PINJOL gitu lohhh???? https://t.co/sHDBSNzxZ1","1797991058636488838","https://pbs.twimg.com/media/GPO_VTEa8AAZCPz.jpg","kumparan","in","Jakarta Capital Region","0","0","1","https://x.com/BudayaJoejoer/status/1797991058636488838","739300488940642304","BudayaJoejoer"
"1798159534319702390","Wed Jun 05 01:06:55 +0000 2024","10","KPU Jamin transparansi data pilkada. Hal ini merupakan komitmen KPU RI dalam transparansi dara2 yg berhubungan dengan Pilkada yg sebentar lgi akan digelar serentak di seluruh Indonesia. Bayar 2jt Mbappe Luhut Pinjol Nahan Madrid #Gajike13Cair Sumatera Innalillahi https://t.co/SS7gwOG4rV","1798159534319702390","https://pbs.twimg.com/media/GPRYkK3awAAMcC7.jpg","","in","","0","1","9","https://x.com/coema_coemi/status/1798159534319702390","1322908062059962369","coema_coemi"
"1796418873417404622","Fri May 31 05:50:09 +0000 2024","10","pemkot jakarta timur bekerjasama dengan polri sat-set dan bergerak cepat #MaksimalTuntaskanKasus salah satunya pinjol ilegal dan judi online yg memicu terjadinya kdrt. ini adalah bentuk Motivasi Tegakkan Hukum tanpa pandang bulu demi wujudkan kamtibmas. https://t.co/Li8GaGUdXE","1796418873417404622","https://pbs.twimg.com/media/GO4pb_saUAIdS7t.jpg","","in","Kota auto pilot","0","1","14","https://x.com/kuyangmanis_/status/1796418873417404622","861604781869092864","kuyangmanis_"
"1777235378522800145","Mon Apr 08 07:21:48 +0000 2024","62708","Indonesia emas 2045 1. Ga bisa perkalian 2. Ga apal geography 3. Kelilit judol 4. Judol pake pinjol 5. pada kena diabetes di 20 awal 6. Bully akun astronomi 7. Kultus influencer/seleb kaya 8. Tukang scam (yg penting duit) 9. Pendidik gaji rendah","1777235378522800145","","","in","Malawi","2245","1144","19008","https://x.com/rzlhmdfz/status/1777235378522800145","247651184","rzlhmdfz"
"1797148730174714111","Sun Jun 02 06:10:21 +0000 2024","12","Orang yang tejerat di banyak pinjol adalah orang orang yang menyepelekan uang. Tanpa kita sadari hutang yang tadinya kecil kini menjadi besar! Pinjol adalah bom waktu secara tidak sadar mereka akan membunuh ekonomimu secara perlahan-lahan.","1797148730174714111","","","in","Bandung, Jawa Barat","0","0","4","https://x.com/solusipinjoll/status/1797148730174714111","1382794203432853507","solusipinjoll"
"1678652147729145856","Tue Jul 11 06:27:14 +0000 2023","35650","So... temen gue dapet transferan dari antah berantah sebesar 20jt Lalu dia dapet watsapp bahwa ada seseorang salah transfer Untung dia nggak bego langsung lapor polisi karena curiga ini penipuan Ternyata bener ada orang udah nyolong data dia apply ke pinjol pake data dia","1678652147729145856","","","in","Behind GM's Screen","639","398","13923","https://x.com/SoundOfYogi/status/1678652147729145856","93882850","SoundOfYogi"
"1797562340717850761","Mon Jun 03 16:40:49 +0000 2024","2","@kotakmakan yang ada ngerokok miras pinjol judol nya ga ilang dan ditambah tapera","1797669781719683469","","kotakmakan","in","Kota Palembang, Sumatera Selat","0","0","0","https://x.com/Nandarizzky123/status/1797669781719683469","1643255527319928834","Nandarizzky123"
"1796016565713838521","Thu May 30 03:11:32 +0000 2024","10","TERNYATA Rindu itu seperti Hutang PinJol Semakin didiamkan semakin banyak dan besar ","1796016565713838521","","","in","161221. penyuka diksi. ","0","5","1","https://x.com/blank_identity9/status/1796016565713838521","1421725952225075203","blank_identity9"
"1798128819397931334","Tue Jun 04 23:04:52 +0000 2024","11","Proyek Bandara IKN Dikebut 1 Agustus Sudah Beroperasi Menteri Perhubungan (Menhub) Budi Karya Sumadi memastikan bandara di Ibu Kota Nusantara (IKN) Kalimantan Timur siap beroperasi 1 Agustus 2024. __ Bayar 2jt Mbappe Luhut Pinjol #Gajike13Cair Sumatera Innalillahi https://t.co/8ZYSdC9H2n","1798128819397931334","https://pbs.twimg.com/media/GPQ8oJnbsAA-8ZV.jpg","","in","East Java, Indonesia","1","4","9","https://x.com/Hansunriko/status/1798128819397931334","1349266626844061696","Hansunriko"
"1797448268886237392","Mon Jun 03 02:00:36 +0000 2024","2","Ya Allah jauhkanlah saya dari pinjol dan orang2 yang pakai pinjol dalam hidupnya.","1797448268886237392","","","in","Indonesia","0","0","1","https://x.com/ocibru/status/1797448268886237392","1341332145810239488","ocibru"
"1798139304994291789","Tue Jun 04 23:46:32 +0000 2024","9","Menhub Budi Karya Sumadi mengatakan pembangunan jalan yang juga merupakan jalur kereta otonom tanpa rel di IKN telah rampung. Kehadiran ART di IKN akan mampu meningkatkan efisiensi serta keamanan. Bayar 2jt Mbappe Luhut Pinjol #Gajike13Cair Sumatera Innalillahi https://t.co/6r2YAcpTky","1798139304994291789","https://pbs.twimg.com/media/GPRGK0NbEAA7Roa.jpg","","in","Nusantara","1","3","8","https://x.com/colorhejo_/status/1798139304994291789","992182146","colorhejo_"
"1796762295919694118","Sat Jun 01 04:34:48 +0000 2024","19","Revisi UU ITE yang diminta: Stop kriminalisasi kebebasan berpendapat lewat pasal karet Hapus pasal yg tumpang tindih dgn aturan lain Tertibkan pinjol ilegal &amp; judol Yang disahkan: https://t.co/Sb1F21snXx","1796762295919694118","https://pbs.twimg.com/media/GO9hyJ1aMAAnYL8.jpg","","in","Jakarta Capital Region","0","1","9","https://x.com/shallypristine/status/1796762295919694118","92804304","shallypristine"
"1797256415062667568","Sun Jun 02 13:18:15 +0000 2024","7","Manifesting hari ini dapat cust yg wangi #zonauang","1797256415062667568","","","in","Her public note","0","1","0","https://x.com/rebibillyhills/status/1797256415062667568","1486223228435853319","rebibillyhills"
"1798102041614831739","Tue Jun 04 21:18:28 +0000 2024","2","Kenapa gawat? Wakil rakyat kita ga perduli pada nasib rakyat yg banyak menderita karena Pinjol dan Judi online ! Belum lagi kelompok agama yg selama ini suka sweping miras dan merasa sbg pemilik surga itu bungkam. Aneh tapi nyata. Ada apa gerangan dgn mereka ?","1798102041614831739","","","in","Bumiayu, Indonesia","1","0","1","https://x.com/sukardiyahya162/status/1798102041614831739","1539724674749579265","sukardiyahya162"
"1798143477857112373","Wed Jun 05 00:03:07 +0000 2024","14","Kapendam XVII Cenderawasih Letkol Inf Candra Kurniawan merespons masifnya serangan OPM dgn sasaran warga sipil. Mereka berdalih dengan menarasikan korbannya merupakan aparat keamanan di media sosial padahal warga sipil. ___ #TumpasKSTPelanggarHAM Bayar 2jt Mbappe Luhut Pinjol https://t.co/tGCMCJOUoY","1798143477857112373","https://pbs.twimg.com/ext_tw_video_thumb/1798143284289953792/pu/img/bSxl2n6qq89IaF30.jpg","","in","Indonesia","2","3","12","https://x.com/Saodah1234/status/1798143477857112373","1272953532535062529","Saodah1234"
"1797416563932627423","Sun Jun 02 23:54:37 +0000 2024","4732","JANGAN PERNAH PINJEMIN ATAU AMBIL PINJOL UNTUK ORANG LAIN!! Gue akuin gue bodoh cuma karena rasa hutang budi. Gue jadi susah sendiri sekarang. Mungkin kalo ada yang kenal bisa tolong bantu tagihin. Gue diblokir semua soalnya","1797416563932627423","","","in","TGR-JKT-CRB","168","211","3462","https://x.com/_anakpolos/status/1797416563932627423","2445871479","_anakpolos"
"1798135709418823996","Tue Jun 04 23:32:15 +0000 2024","10","KPU Jamin Transparansi Data Pilkada KPU RI menyatakan akan menjaga data pemilih Pilkada Serentak 2024. Dan mencegah terjadinya kebocoran data pemilih Pilkada Serentak 2024. Bayar 2jt Mbappe Luhut Pinjol #Gajike13Cair Sumatera Innalillahi https://t.co/ToDrCPrs1F","1798135709418823996","https://pbs.twimg.com/media/GPRC5cMa0AAPv6E.jpg","","in","Indonesian","1","3","10","https://x.com/Clara_Shinta99/status/1798135709418823996","322559270","Clara_Shinta99"
"1797027846835392523","Sun Jun 02 01:57:18 +0000 2024","15","@tanyakanrl Pacar pertama Tapi km udh di jebol Data di pake pinjol Ini mah emng km nya yg bucin tolol maaf nder gak ada solusi untuk org yg udh bucin selain km sendiri yg emng mau berhenti goblok","1797085049042751905","","tanyakanrl","in","Jawa Tengah, Indonesia","0","0","1","https://x.com/Vwxyz58/status/1797085049042751905","2375257686","Vwxyz58"
"1797403665235689713","Sun Jun 02 23:03:22 +0000 2024","2","Ternyata ada yang lebih parah daripada Aku. Makanya jangan mau mengatasnamakan diri sendiri ke pinjol atau kartu kredit. Ntar malah runyam ","1797403665235689713","","","in","DKI Jakarta, Indonesia","0","1","0","https://x.com/ufik_25/status/1797403665235689713","4849278060","ufik_25"
"1798155807357645224","Wed Jun 05 00:52:07 +0000 2024","10","OPM tak ingin Papua maju. OPM bahkan meneror masyarakat dn. Membunuh warga. Terakhir tukang ojek diserang hingga tewasss. Sikat OPM dari bumi Papua. #TumpasKSTPelanggarHAM Bayar 2jt Mbappe Luhut Pinjol Nahan Madrid https://t.co/b1PSxDUbdX","1798155807357645224","https://pbs.twimg.com/ext_tw_video_thumb/1798155725337968641/pu/img/8_JDdMvXKrF-QRbR.jpg","","in","","0","3","10","https://x.com/coema_coemi/status/1798155807357645224","1322908062059962369","coema_coemi"
"1797881619287863711","Tue Jun 04 06:42:35 +0000 2024","648","BPK melaporkan dugaan fraud PT Indofarma Tbk (INAF) mencapai Rp 294 77 miliar salah satunya karena pinjaman online (pinjol) yang tidak dilapokan di laporan keuangan. #bisnisupdate #update #Bisnis https://t.co/gKma105oyb","1797881619287863711","","","in","","125","96","326","https://x.com/kumparan/status/1797881619287863711","759692754985242625","kumparan"
"1710486227013783781","Sat Oct 07 02:44:30 +0000 2023","10217","Gerakan nikah muda indonesia tanpa pacaran atau sejenisnya sekarang udah gak laku lagi korbannya sekarang pada punya anak dan nongkrong di grup catatan hati seorang istri dan grup pinjol gagal bayar","1710486227013783781","","","in","","645","365","3399","https://x.com/komikbabi/status/1710486227013783781","1198204481680207873","komikbabi"
"1797782813812699143","Tue Jun 04 00:09:58 +0000 2024","10","Tes dulu sebelum open lewat ga? #zonauang","1797782813812699143","","","in","start 08:00 - sleep💤","0","0","0","https://x.com/bnrbgt/status/1797782813812699143","1616271314578460673","bnrbgt"
"1797416563932627423","Mon Jun 03 05:33:48 +0000 2024","47","@_anakpolos Titip jejak. Aku lg ngalamin kayak gini jg. Org ini blm byr sm sekali hutang pinjol sdh 1 thn. Dulu ngemis2 minta tlg ke aku. Namanya Cesar Titan Rakayuzha Yusuf tinggal di Kp. Loji Tapos Kab. Bogor. Ig-nya : @.crakayuzha Btw blio alumni nesaci smanic gunadarma https://t.co/5WZWa4YIS5","1797501918539038929","https://pbs.twimg.com/media/GPICdc-awAEPpOB.jpg","_anakpolos","in","","0","1","11","https://x.com/cielygnus/status/1797501918539038929","769998957309198336","cielygnus"
"1796825826627133668","Sat Jun 01 08:47:15 +0000 2024","7","Hal yg paling nyebelin adalah nomor diri dipakai untuk data darurat pinjol :) ","1796825826627133668","","","in","Kota Surabaya, Jawa Timur","0","3","0","https://x.com/nayasandika/status/1796825826627133668","1590363896694464517","nayasandika"
"1797268295596544085","Tue Jun 04 04:14:12 +0000 2024","15","@wonniexym Halu tingkat tinggi. Goblok nya bukan main.","1797844278514991109","","wonniexym","in","","0","1","0","https://x.com/Rampagexy/status/1797844278514991109","1686047759470878720","Rampagexy"
"1794903082540962032","Mon May 27 01:26:57 +0000 2024","61","Ini Baru Kebijakan yg Super sekali‼️ Biaya Kuliah Tinggi Mahasiswa dan Calon Mahasiswa yg Gak Mampu bisa mendapat Fasilitas Pinjol Lha kowe kie Pejabat opo Rentenir John?? https://t.co/m2QYCkk5ao","1794903082540962032","https://pbs.twimg.com/ext_tw_video_thumb/1794902904622772224/pu/img/0KSNOXP8mQB1Oowa.jpg","","in","Di hatimuuuu 🥰","1","10","33","https://x.com/AraituLaki/status/1794903082540962032","1118723550649544704","AraituLaki"
"1797969590838042768","Wed Jun 05 03:19:25 +0000 2024","2","@Bisniscom Defisit 600 triliun ? Trus bakal bayar utang caina + bunganya gimana donk apa mesti kayak pinjol gali lubang tutup lubang ?","1798192875874009598","","Bisniscom","in","Jakarta Capital Region","0","1","0","https://x.com/Jakasamudera123/status/1798192875874009598","1486485379767144451","Jakasamudera123"
"1796787528223318112","Sat Jun 01 06:21:05 +0000 2024","5","@tanyarlfes Banyak kasus yang seperti ini dan penyesalaiannya masih belum jelas. Yang pasti uang ga akan balik lagi sebaiknya ganti penyedia layanan untuk menghindari resiko terulang kejadian seperti ini","1796789045961621920","","tanyarlfes","in","","0","0","2","https://x.com/Aria_Consultant/status/1796789045961621920","773221980002721792","Aria_Consultant"
"1764210682659324395","Sun Mar 03 08:46:18 +0000 2024","8399","Rajin: - Rumah tidak terbeli - Utang pinjol buat kebutuhan sehari-hari - Beras telur minyak goreng tidak terjangkau - Burned out karena merasa tidak dihargai kerja kerasnya underpaid dan overwork. Santai lambat dan malas: - Rumah tidak terbeli - Utang pinjol buat","1764210682659324395","","","in","Michuhol-gu, Republic of Korea","292","347","2376","https://x.com/ardisatriawan/status/1764210682659324395","170542374","ardisatriawan"
"1798083549763101100","Tue Jun 04 20:04:59 +0000 2024","57","Miris &amp; menyedihkan melihat hsl audit BPK terhadap perusahaan BUMN PT Indofarma salah satu penyebab kerugian ada tarik utang pinjol lha bukannya BUMN punya bank sndr knp hrs pinjol pantas aja smp ga mampu bayar karyawan... Angel Wes angel tuturane https://t.co/MqC8R7rE5g https://t.co/GASyQLQQ3v","1798083549763101100","https://pbs.twimg.com/media/GPQTdEzbQAAPB6i.jpg","","in","","9","17","44","https://x.com/AntoniusCDN/status/1798083549763101100","4184979312","AntoniusCDN"
"1797884520043295133","Tue Jun 04 06:54:07 +0000 2024","8","halo tolong dong yang mau dm baca dulu ini sama thread dibawahnya ada juga. klo mau lihat penagihan dll ad di pinned thread scroll aja lengkap. oya btw sekarang gw udah masuk bulan ke-13 galbay pinjol. tolong punten soalnya capek balesin yg itu2 aja","1797884520043295133","","","in","San Francisco, CA","0","0","0","https://x.com/keluhkesahcaca/status/1797884520043295133","1582096523139350529","keluhkesahcaca"
"1795635575925653742","Wed May 29 01:57:37 +0000 2024","8","Masuk? #zonauang","1795635575925653742","","","in","start 08:00 - sleep💤","0","0","0","https://x.com/bnrbgt/status/1795635575925653742","1616271314578460673","bnrbgt"
"1592323675197681665","Tue Nov 15 01:08:42 +0000 2022","15768","breaking news : ratusan mahasiswa IPB diduga terjerat pinjol total dana bergulir ditaksir mencapai angka miliyar. saat ini pihak kampus tengah melakukan upaya-upaya bantuan hukum.","1592323675197681665","","","in","Kota Bengkulu, Indonesia","1107","577","2994","https://x.com/direktoridosen/status/1592323675197681665","1901591046","direktoridosen"
"1796058615683371084","Thu May 30 05:58:37 +0000 2024","4","Bukannya gamau dideketin trauma sama yang masih punya urusan dengan pinjol","1796058615683371084","","","in","Karawang","0","2","0","https://x.com/Lxngga/status/1796058615683371084","964497086958809088","Lxngga"
"1797224830410100736","Sun Jun 02 11:12:50 +0000 2024","6","Intinya yang belum pernah pinjol jangan pernah pake pinjol ! Yang sudah pake pinjol beranikan dirimu untuk galbay ! Sebelum kau hancur !","1797224855139664345","","solusipinjoll","in","Bandung, Jawa Barat","0","1","2","https://x.com/solusipinjoll/status/1797224855139664345","1382794203432853507","solusipinjoll"
"1797906490331975857","Tue Jun 04 08:21:25 +0000 2024","2","Congrats!! Boleh kirim E-wallet nya ke dm aku ya @SilaKim6 @alvchive https://t.co/jDBqXA4MHf","1797906490331975857","https://pbs.twimg.com/media/GPNya90aQAA_iv8.jpg","","in","Her public note","0","3","0","https://x.com/rebibillyhills/status/1797906490331975857","1486223228435853319","rebibillyhills"
"1556472729603166210","Mon Aug 08 02:49:51 +0000 2022","4695","Penyakit lama. Klo saya blh tebak kamu daftar JENIUS dan Pinjol yg tiba2 nagih kamu itu Kredit Pintar? Bener ngga?","1556472729603166210","","","in","","394","167","1912","https://x.com/Partono_ADjem/status/1556472729603166210","830258717341806592","Partono_ADjem"
"1795379900238766129","Tue May 28 09:01:39 +0000 2024","9","Bad financial decision: - Pinjol - Pake paylater ugal an - Thrifting tapi gak nawar - Pinjemin uang ke keluarga - Pinjemin uang ke temen - Masuk Sephora - Beli konten trakteer ato G-Drive Lanjutin kalo ada yang lain ","1795379900238766129","","","in","Jakarta","0","2","2","https://x.com/brenbrndn/status/1795379900238766129","2262816079","brenbrndn"
"1797383806502183202","Sun Jun 02 21:44:27 +0000 2024","10","Yeuhhhhhhh LOGIKANYA TIDAK DI PAKAI!!! INCOME DIA GEDE NGAPAIN MINTA LO BUAT PINJAL PINJOL?!!!!! Dari situ aja udah jelas kalo income dia yang segitu cuman halu2! ","1797383806502183202","","","in","Karawang Timur, Indonesia","0","3","0","https://x.com/Setobeli_Mungil/status/1797383806502183202","1682762385403285504","Setobeli_Mungil"
"1796524243947290987","Fri May 31 12:48:52 +0000 2024","7","Sanjaya ikut pamer foto KTP. NIK dan alamat disensor khawatir disalahgunakan ke pinjol. #OCsbase #OC #DaindrawsOC #artidn https://t.co/r61sjdw76F","1796524243947290987","https://pbs.twimg.com/media/GO6IeGnagAAr8TY.jpg","","in","","0","0","2","https://x.com/daindraws/status/1796524243947290987","1642976177194434560","daindraws"
"1798129530735096047","Tue Jun 04 23:07:42 +0000 2024","10","Kehadiran Jalan Trans-Papua tdk saja memberi kemudahan dlm mobilitas manusia jasa dan barang tetapi juga manfaat secara ekonomi telah dirasakan oleh masyarakat Papua. Demi pemerataan dan perwujudan keadilan #TumpasKSTPelanggarHAM Bayar 2jt Mbappe Luhut Pinjol https://t.co/qz9ESErnul","1798129530735096047","https://pbs.twimg.com/media/GPQ9R3vbcAAt8L1.jpg","","in","","1","4","10","https://x.com/Nidyna10/status/1798129530735096047","1710309382293004288","Nidyna10"
"1384478754706137094","Tue Apr 20 12:07:12 +0000 2021","2592","Pinjol. Tiba2 satu mobil a***nza hitam berenti dpn rumah. Isinya cowok badan tegap2 ada 5 orang. Ada yg pinjem uang pake alamat rmh gw. Ko bisa? Nama yg pinjem katanya Yendra udah dibilangin ga kenal nama itu kagak percaya. celingukan kedlm rumah &amp; ngerusak pot bunga ","1384478754706137094","","","in","DKI Jakarta, Indonesia","59","254","658","https://x.com/zomet13/status/1384478754706137094","1189195077836398592","zomet13"
"1798140910372638721","Tue Jun 04 23:52:55 +0000 2024","15","Tim gabungan Bea Cukai menggagalkan penyeludupan 15 9 juta batang rokok ilegal atau yang tidak dilekati pita cukai dalam dua operasi penindakan terpisah di perairan Provinsi Aceh. ___ Bayar 2jt Mbappe Luhut Pinjol #Gajike13Cair Sumatera Innalillahi https://t.co/OcHI97iMRA","1798140910372638721","https://pbs.twimg.com/media/GPRHn4gbcAA-Z9r.jpg","","in","Indonesia","2","2","12","https://x.com/Saodah1234/status/1798140910372638721","1272953532535062529","Saodah1234"
"1797881619287863711","Tue Jun 04 07:51:50 +0000 2024","7","@kumparan BUMN ngais utang Pinjol.... &gt;&gt; indikasi TPPU","1797899046520303785","","kumparan","in","Indonesia","0","0","0","https://x.com/SazaKubilla/status/1797899046520303785","1081175844511313920","SazaKubilla"
"1798137075268825429","Tue Jun 04 23:37:41 +0000 2024","12","PLT Kepala Otorita IKN Nusantara Basuki Hadimuljono Segera Selesaikan 2.086 Ha Lahan Yang Masih Bermasalah Basuki akan segera menyelesaikan persoalan tersebut dengan mengutamakan kepentingan rakyat. Bayar 2jt Mbappe Luhut Pinjol #Gajike13Cair Sumatera Innalillahi https://t.co/GFa3GaAmEz","1798137075268825429","https://pbs.twimg.com/media/GPREI79bYAA3cUR.jpg","","in","DKI Jakarta, Indonesia","2","2","8","https://x.com/rasa2086/status/1798137075268825429","1290494259791933443","rasa2086"
"1795286500340556281","Wed May 29 03:20:14 +0000 2024","2","Aceh sdg di rusak dgn Narkoba LBGT Pinjol dan Judol https://t.co/rGPPDV5GMw","1795656366205575550","https://pbs.twimg.com/ext_tw_video_thumb/1795656264384712704/pu/img/sbCVoYhlqWH9XqyQ.jpg","Aceh","in","Aceh, Indonesia","0","2","0","https://x.com/Aceh/status/1795656366205575550","9688522","Aceh"
"1798130726157816239","Tue Jun 04 23:12:27 +0000 2024","9","Mari kita sukseskan Pilkada untuk memilih gubernur bupati dan wali kota yg diselenggarakan serentak di seluruh daerah. Dengan menjadi pemilih yg bijak masyarakat turut berkontribusi dalam menyukseskan pelaksanaan Pilkada 2024. _ Bayar 2jt Mbappe Luhut Pinjol Pagi #Gajike13Cair https://t.co/8iVdJD25t8","1798130726157816239","https://pbs.twimg.com/media/GPQ-XK9a8AAlQ4g.jpg","","in","","1","0","8","https://x.com/Tatarori80/status/1798130726157816239","1373275046970462214","Tatarori80"
"1798137467167752454","Tue Jun 04 23:39:14 +0000 2024","11","Kapendam Cenderawasih: OPM Gerombolan yang Ingin Papua Terpuruk Kapendam XVII Cenderawasih Letkol Inf Candra Kurniawan merespons masifnya serangan Organisasi Papua Merdeka (OPM) dengan sasaran warga sipil. #TumpasKSTPelanggarHAM Bayar 2jt Mbappe Luhut Pinjol https://t.co/bWXFsGNBSk","1798137467167752454","https://pbs.twimg.com/ext_tw_video_thumb/1798137413262524416/pu/img/SqiHdyYZouSDROc7.jpg","","in","DKI Jakarta, Indonesia","1","3","10","https://x.com/rasa2086/status/1798137467167752454","1290494259791933443","rasa2086"
"1798021114784047260","Tue Jun 04 15:56:54 +0000 2024","1","[cm] PLEASE NOTICE SENDER‼️ halo teman2 sender boleh minta tolong isiin kuesioner tentang pinjol dong baik yg nggak make make atau ada org terdekatnya pake tolong rep ya (datanya dijamin aman ya dan ngga disuruh isi no hp!!) https://t.co/KpDLnWQWZC","1798021114784047260","https://pbs.twimg.com/media/GPParGObAAAoy31.jpg","","in","","0","23","0","https://x.com/collegemenfess/status/1798021114784047260","1046084008742801408","collegemenfess"
"1797027846835392523","Sat Jun 01 23:02:09 +0000 2024","4","@tanyakanrl oke mari kita urai dulu - soal dia ancem sebar video tidak tidak itu segera hubungi lbh atau komnas perempuan. banyak di twt yang udah sebar hotline nya tapi aku ga save - soal pinjol karena ini ilegal ga akan kena bi checking jadi kalo ga dibayar si gapapa","1797040972167360660","","tanyakanrl","in","location unknown","0","2","0","https://x.com/chibicatsaurus/status/1797040972167360660","1028859896341512192","chibicatsaurus"
"1797594303050723768","Mon Jun 03 11:53:45 +0000 2024","6","@AsahPolaPikir Mau punya cicilan KPR cicilan Pinjol cicilan mobil yg gajinya UMR atau lebih judulnya WAJIB ikut Tapera.","1797597537320440101","","AsahPolaPikir","in","","0","0","0","https://x.com/sucipto0212/status/1797597537320440101","3018952314","sucipto0212"
"1798142689772441716","Tue Jun 04 23:59:59 +0000 2024","4","Saat ini kalangan bawah indonesia dihajar judi online pay later dan pinjol . Kalangan menengah dihajar investasi bodong . Dimana kehadiran pemerintah sebenernya https://t.co/CNNS9lm083","1798142689772441716","https://pbs.twimg.com/media/GPRJPMtbcAAGa8d.jpg","","in","","0","3","0","https://x.com/andikaseb/status/1798142689772441716","190170610","andikaseb"
"1795729987213164715","Wed May 29 08:12:46 +0000 2024","3","pada buru2 amat berasa dikejar pinjol","1795729987213164715","","","in","unlabeled.","0","7","0","https://x.com/mortefiq/status/1795729987213164715","746244364725157888","mortefiq"
"1798198933916885045","Wed Jun 05 03:43:29 +0000 2024","5","Kayanya kalo dah bebas pinjol tenang bgt idupku ","1798198933916885045","","","in","Side B | Jakarta , Bekasi","0","5","0","https://x.com/urscrtistvan/status/1798198933916885045","1573183574240788480","urscrtistvan"
