"conversation_id_str","created_at","favorite_count","full_text","id_str","image_url","in_reply_to_screen_name","lang","location","quote_count","reply_count","retweet_count","tweet_url","user_id_str","username"
"1798128064964317431","Tue Jun 04 23:01:52 +0000 2024","9","Kodam XVII/Cenderawasih membantah adanya prajurit TNI ditembak mati oleh OPM di Kabupaten Puncak Jaya. Itu semua hoax yang sengaja disebar oleh gerombolan OPM dan simpatisannya. ___ #TumpasKSTPelanggarHAM Bayar 2jt Mbappe Luhut Pinjol https://t.co/XpN0drFJpk","1798128064964317431","https://pbs.twimg.com/ext_tw_video_thumb/1798127972043698176/pu/img/OwY_dU3qMIINMpqX.jpg","","in","East Java, Indonesia","1","3","9","https://x.com/Hansunriko/status/1798128064964317431","1349266626844061696","Hansunriko"
"1798193375251963916","Wed Jun 05 03:21:24 +0000 2024","4","Kerja kerja kerja Hutang hutang hutang Akhirnya Pinjol Judol Pompa terussss https://t.co/iW7YXVLook","1798193375251963916","https://pbs.twimg.com/media/GPR3WBFaYAAZSzA.jpg","","in","Unknown Metaverse ","0","1","1","https://x.com/Iconman221/status/1798193375251963916","1501028490279518208","Iconman221"
"1798127778220667135","Tue Jun 04 23:00:44 +0000 2024","11","Tim gabungan Bea Cukai berhasil menggagalkan penyelundupan 15 juta batang rokok ilegal dalam dia kali penangkapan selama Mei 2024 di perairan Aceh. Selain rokok petugas juga mengamankan 5 pelaku dari operasi tersebut. Bayar 2jt Mbappe Luhut Pinjol #Gajike13Cair Sumatera https://t.co/CuZ3X78sIJ","1798127778220667135","https://pbs.twimg.com/media/GPQ7r0fbMAAky_i.jpg","","in","Indonesia","1","3","8","https://x.com/Anggita_lung/status/1798127778220667135","2907040202","Anggita_lung"
"1798131430620647846","Tue Jun 04 23:15:15 +0000 2024","11","OPM selalu menginginkan pertumpahan darah dan ingin masyarakat menderita. Mereka penjahat-penjahat kemanusiaan. Kapendam Cenderawasih menegaskan TNI ttap akan bertindak tegas utk menjaga dan melayani masyarakat. #TumpasKSTPelanggarHAM _ Bayar 2jt Mbappe Luhut Pinjol Sumatera https://t.co/ZNxxrca0gQ","1798131430620647846","https://pbs.twimg.com/ext_tw_video_thumb/1798131346579300352/pu/img/gKfob6rIBgS2GiSz.jpg","","in","","1","4","8","https://x.com/Tatarori80/status/1798131430620647846","1373275046970462214","Tatarori80"
"1798195658996019705","Wed Jun 05 03:31:59 +0000 2024","17","@ARSIPAJA Urusan bokep aja cepet bgt.. judol pinjol scam dll pada kmna?","1798196040933539986","","ARSIPAJA","in","pluto","0","1","0","https://x.com/bullshitsme/status/1798196040933539986","1456181367906000897","bullshitsme"
"1798025648608522598","Tue Jun 04 16:14:54 +0000 2024","45","Bang hati-hati itu pegang ktp ketemu tukang pinjol ntar","1798025648608522598","","","in","🦢🦈🐱","0","2","0","https://x.com/NATHANPROTECT/status/1798025648608522598","1741765945645989888","NATHANPROTECT"
"1797513454959636691","Mon Jun 03 10:04:41 +0000 2024","63","@tanyakanrl Judol dan pinjol 2sejoli yg harus dimusnahkan tp herannya malah makin menjamur. Tetanggaku jg ada yg sampe 300jt lebih dan siapa yg nanggung? Ortunya yg gatau apa² krn si tersangka kabur ntah kemana sedangkan dc datang bergantian. Trs ada jg yg sampe 400jt yg stress ortunya lah","1797570089895739476","","tanyakanrl","in","","1","6","2","https://x.com/Fat2fat1/status/1797570089895739476","1362059048581885954","Fat2fat1"
"1798135895553683937","Tue Jun 04 23:32:59 +0000 2024","10","OPM Ingin Papua Terpuruk OPM selalu menginginkan pertumpahan darah dan ingin masyarakat menderita. Mereka penjahat-penjahat kemanusiaan dan sudah seharusnya ditindak tegas hingga ke akar-akarnya. #TumpasKSTPelanggarHAM Bayar 2jt Mbappe Luhut Pinjol https://t.co/0izS0SrtjM","1798135895553683937","https://pbs.twimg.com/ext_tw_video_thumb/1798135839245090816/pu/img/Xz61J0I3_zYSPztk.jpg","","in","Indonesian","1","4","10","https://x.com/Clara_Shinta99/status/1798135895553683937","322559270","Clara_Shinta99"
"1797506276085370924","Mon Jun 03 05:55:49 +0000 2024","3","@tanyarlfes Klo di hpku ada setting buat nolak panggilan dari nomer asing secara otomatis aku pake itu karena nomorku sempet dipake mama jadi kontak darurat pinjol tanpa sepengetahuanku :)","1797507460993044727","","tanyarlfes","in","","0","1","0","https://x.com/chaffelatte_/status/1797507460993044727","1657390156293496832","chaffelatte_"
"1796161993407115430","Thu May 30 15:47:43 +0000 2024","9","@unnesmenfess trus mau minjem uang 1 5 jt tapi gak dibolehin malah temennya yg diblok. ada juga temennya yg disuruh install pinjol wkwk. pdhl sering post hedon post uang thr post dapet 100jt pertama wkwk kocak dah 100jt mending bayar utangmu mbak.","1796206864436494623","","xddyrin","in","","0","2","1","https://x.com/xddyrin/status/1796206864436494623","1276754094892277761","xddyrin"
"1798158741898244422","Wed Jun 05 01:03:46 +0000 2024","9","Bea Cukai gagalkan dua upaya penyelundupan rokok ilegal yang diangkut kapal melalui perairan Aceh pada Mei 2024. Bea Cukai berhasil amankan 15 juta batang rokok ilegal. Bayar 2jt Mbappe Luhut Pinjol Nahan Madrid #Gajike13Cair Sumatera Innalillahi https://t.co/uxvLafPsUY","1798158741898244422","https://pbs.twimg.com/media/GPRX2AVbwAA15Af.jpg","","in","","0","1","9","https://x.com/coema_coemi/status/1798158741898244422","1322908062059962369","coema_coemi"
"1769589513804993022","Mon Mar 18 04:59:52 +0000 2024","10764","Masalah orang-orang sekarang 1) Rumah gak bisa terbeli 2) Harga kebutuhan pokok mahal 3) Upah pekerja gak layak 4) Uang sekolah anak gak ngotak 5) UKT kuliah kalau gak dapet beasiswa harus pinjol. Solusi yang ditawarkan sekarang: 1) Kan rumah bisa sewa atau numpang ortu 2)","1769589513804993022","","","in","Michuhol-gu, Republic of Korea","191","367","3900","https://x.com/ardisatriawan/status/1769589513804993022","170542374","ardisatriawan"
"1796555199534039086","Fri May 31 14:51:52 +0000 2024","2","yuk jgn sampe kena tipu oknum joki pinjol dan sebangsanya udah mah kita puyeng kejebak pinjol eh masih aja disuruh transfer duit ke joki joki penipu ini yg paling bisa buat lawan masalah ini ya kita sendiri...tenang nafas dulu... yuk kuat bareng kita sama-sama debtfree","1796555199534039086","","","in","","0","0","0","https://x.com/tteokxz/status/1796555199534039086","949231097468002304","tteokxz"
"1796673951697101309","Fri May 31 22:43:45 +0000 2024","2","Kok ga punya ktp emang ga ikutan pinjol?","1796673951697101309","","","in","Indonesia","0","0","1","https://x.com/aipsnbrp/status/1796673951697101309","1710685165922738176","aipsnbrp"
"1795265649100603731","Tue May 28 01:27:39 +0000 2024","6","plis hari ini klu ada spam pinjol dr mna pun itu ke aku aja jngn ke kondar","1795265649100603731","","","in","","0","1","3","https://x.com/Peachhvy14/status/1795265649100603731","1775146768726097921","Peachhvy14"
"1798029942686691332","Tue Jun 04 16:31:58 +0000 2024","8","Salah satu indikasi fraud di indofarma ada melakukan pinjol? Dilansir dari temuan BPK dalam hal ini pemegang saham tampaknya yg dimaksud telah melakukan pinjaman online (fintech) serta menampung dana restitusi pajak pada rekening bank yang tidak dilaporkan di laporan keuangan https://t.co/vmGghNiskh","1798029942686691332","https://pbs.twimg.com/media/GPPitC1bMAArz3I.jpg","","in","Planeta Rica, Colombia","0","1","9","https://x.com/5teV3n_Pe9eL/status/1798029942686691332","224431376","5teV3n_Pe9eL"
"1798149217317437595","Wed Jun 05 00:25:56 +0000 2024","12","Mantap nih kinerja Bea Cukai yg berhasil gagalkan penyelundupan 15 9 juta batang rokok di Aceh Penggagalan upaya penyelundupan ini merupakan wujud upaya Bea Cukai dlm memperketat pengawasan &amp; pemberantasan pelanggaran di bidang kepabeanan dan cukai Bayar 2jt Mbappe Luhut Pinjol https://t.co/SZYAXZsAPB","1798149217317437595","https://pbs.twimg.com/media/GPRPLeAbEAAvuM8.jpg","","in","Bandung, Indonesia","1","2","12","https://x.com/septixtang/status/1798149217317437595","1334156528174022659","septixtang"
"1797436331465085288","Mon Jun 03 01:13:10 +0000 2024","2","Intinya gini lo mau minjemin tuh orang duit artinya siap kehilangan uang. Lo siap ilang berapa? Gue sih jujur ga siap ilang duit 3 juta pun. Usahakan jgn pake pinjol buat ngelatih org itu juga kalo BU dan pinjol bukan solusi tp gali lobang tutup lobang.","1797436331465085288","","","in","","0","2","1","https://x.com/morlelahversion/status/1797436331465085288","1694642938608058368","morlelahversion"
"1797212821555724573","Mon Jun 03 01:41:16 +0000 2024","43","@talangijoo Biasa aj lah semua orang berhak kaya trmasuk kyai pendeta atau pemuka agama apapun. Elo aj yg miskin dan iri dengki. Makanya jgn kebanyakan judol dan pinjol haha....","1797443400821842331","","talangijoo","in","Rangkasbitung, Indonesia","0","0","0","https://x.com/mhsyid/status/1797443400821842331","1715142803553214464","mhsyid"
"1797154321320345839","Sun Jun 02 06:32:34 +0000 2024","3","Jangan ngasih pinjem akun pinjol ke siapapun dengan embel² temen pacar keluarga. Nanti aku bayar on time kok Alaaahhhhhhh TAI...","1797154321320345839","","","in","Bekasi, Jawa Barat","0","5","0","https://x.com/EL3G1/status/1797154321320345839","1514615130876629002","EL3G1"
"1797881619287863711","Tue Jun 04 06:51:48 +0000 2024","7","@kumparan Bumn ada pinjol? Keren juga","1797883937597083661","","kumparan","in","","0","0","0","https://x.com/speedyrj/status/1797883937597083661","29346406","speedyrj"
"1767821852305764566","Wed Mar 13 07:55:48 +0000 2024","14584","1) Rumah gak bisa terbeli 2) Harga kebutuhan pokok mahal 3) Upah pekerja gak layak 4) Uang sekolah anak gak ngotak 5) UKT kuliah kalau gak dapet beasiswa harus pinjol. Terus pada bertanya-tanya kenapa generasi muda gak bisa nabung angka nikahnya turun dan memilih","1767821852305764566","","","in","Michuhol-gu, Republic of Korea","307","301","5438","https://x.com/ardisatriawan/status/1767821852305764566","170542374","ardisatriawan"
"1798128030981980525","Tue Jun 04 23:01:44 +0000 2024","10","Kapendam XVII/Cenderawasih Letkol Inf Candra Kurniawan mengatakan warga sipil atas nama Zainul yang ditembak mati OPM di Puncak Jaya bukan anggota TNI. Tidak benar Prajurit TNI ditembak mati OPM di Mulia Kab. Puncak Jaya. #TumpasKSTPelanggarHAM Bayar 2jt Mbappe Luhut Pinjol https://t.co/nHSjKTC3uZ","1798128030981980525","https://pbs.twimg.com/media/GPQ76kXbsAAzS52.jpg","","in","Indonesia","1","4","9","https://x.com/Anggita_lung/status/1798128030981980525","2907040202","Anggita_lung"
"1795992274213507395","Thu May 30 01:35:00 +0000 2024","9","pinjol tai bgt idup gue beneran kaga tenang","1795992274213507395","","","in","","0","0","12","https://x.com/jtisbig/status/1795992274213507395","1763503843286147072","jtisbig"
"1795645857284628618","Wed May 29 02:38:28 +0000 2024","3","Salah aku jgk terlalu kburu2 ambil keputusan Ok bulan ini terbayar Pinjol.a entah Bulan dpnBank gak cair Bi cheking segala sihBelom lagi Koperasi ku setiap hari adaHbs ya klau gk pinjam sm mereka ke siapa lgi..?saudara gak bkl di bantu di Hina ya️di sinipun sll Zonk","1795645857284628618","","","in","","0","1","0","https://x.com/mayrayeye321/status/1795645857284628618","2895233655","mayrayeye321"
"1795874226852999558","Wed May 29 17:45:56 +0000 2024","6","Bro just showing how hard living in Idn 1. Kerja tengah malem 2. Sulitnya dapetin pendidikan layak dengan tenang 3. Terjerat pinjol karna poin 1&amp;2 4. Ada yang reach out setelah mengalami kehidupan hectic 5. Diteror ditipu lalu diperas","1795874226852999558","","","in","","0","0","0","https://x.com/troughaljourney/status/1795874226852999558","1662132810688372736","troughaljourney"
"1798168805497336117","Wed Jun 05 01:43:46 +0000 2024","4","Dan yg lucunya itu Indofarma yg merupakan perusahaan BUMN malah terlibat pinjol...lha kan aneh banget pdhl BUMN sndr banknya besar2","1798168805497336117","","","in","","0","1","2","https://x.com/AntoniusCDN/status/1798168805497336117","4184979312","AntoniusCDN"
"1797047439662473305","Sat Jun 01 23:33:21 +0000 2024","13","@tanyarlfes CMIIW. pernah denger katanya gt tu orang mau cairin limit paylater kl misal adeknya kakak tf balik ntar malah disuruh ngelunasin pinjol. untuk solusinya kurtaw gimana soalnya kl misal nyasarnya ke rek bank tinggal lapor","1797048822436380819","","tanyarlfes","in","","0","0","0","https://x.com/yofinonuno/status/1797048822436380819","1719205817998888960","yofinonuno"
"1798135682206167534","Tue Jun 04 23:32:09 +0000 2024","9","Jangan Termakan Adu Domba Antara OAP Dan Pendatang Oleh KNPB Adu domba yang dilakukan oleh kelompok separatis yang tidak bertanggungjawab dengan tujuan merusak kerukunan ketentraman dan kedamaian di tanah Papua. #TumpasKSTPelanggarHAM Bayar 2jt Mbappe Luhut Pinjol https://t.co/XkAPndKmWn","1798135682206167534","https://pbs.twimg.com/media/GPRC338agAE2HCu.jpg","","in","Indonesian","1","3","9","https://x.com/Clara_Shinta99/status/1798135682206167534","322559270","Clara_Shinta99"
"1796073667446681704","Thu May 30 14:18:36 +0000 2024","5","@CNNIndonesia yaAllah gak kasian sama rakyat? negara udah kaya pinjol","1796184439090819169","","CNNIndonesia","in","she/her","0","1","0","https://x.com/kookiesther/status/1796184439090819169","1304606755687596033","kookiesther"
"1797781592754331657","Tue Jun 04 00:18:30 +0000 2024","5","@worksfess Pikirin aja di luar sana banyak orang yg gapunya kerjaan sampe harus pinjol demi beli beras puasa demi bisa ngeprint CV pulang menghadapi muka kecewa orang tua karena ga lolos interview Nah kalo udah gini setidaknya kerasa kan beruntungnya kamu yg punya kerjaan?","1797784959803097153","","worksfess","in","she/her ll 20+","0","0","0","https://x.com/lavaytera/status/1797784959803097153","852309885286875136","lavaytera"
"1797216793653875184","Sun Jun 02 11:23:30 +0000 2024","29","@tanyakanrl Follow duluan aja langsung follback nih","1797227536403075388","","tanyakanrl","in","","0","0","0","https://x.com/Aria_Consultant/status/1797227536403075388","773221980002721792","Aria_Consultant"
"1797944066988179834","Tue Jun 04 13:41:57 +0000 2024","3","@SerieA_Lawas Inter musim depan ga ada utang pinjol Marotta jadi presiden inter Zanetti tetap wapres Sepertinya Inter makin sulit juara serie B ","1797987154452451415","","SerieA_Lawas","in","","0","1","0","https://x.com/eka_internist1/status/1797987154452451415","1496367764684308480","eka_internist1"
"1797432463972815256","Mon Jun 03 00:57:48 +0000 2024","4","Pelajaran aja sih jadinya Kalo mau pinjol ya mending buat diri sendiri Karena orang lain belum tentu bayar utangnya Ruginya banyak sumpah ini mas tama Udah rugi uang rugi BI check belum lagi disuruh resign Double double","1797432463972815256","","","in","","0","0","1","https://x.com/ArthurianWitch/status/1797432463972815256","538110887","ArthurianWitch"
"1797339180810523027","Sun Jun 02 18:47:08 +0000 2024","4","Jelek bgt mukanya pasti kontolnya loyo karena kebanyakan ngelem. Buat sendernya sedih gw bacanya. Why?? Kek semudah itu buat pinjol ke orang yang notabene belom kenal dari lahir gitu loh. Semoga cepet selesai masalahnya ya","1797339180810523027","","","in","Ndes!","0","0","0","https://x.com/balonadadua/status/1797339180810523027","3286160696","balonadadua"
"1797595086987129331","Tue Jun 04 00:37:35 +0000 2024","9","@yangjujuw Daftarin pinjol aja kalo anaknya gak ada itikad baik. Ada kan foto ktp sama dia pegang ktp. Biar tau rasa","1797789765045219635","","yangjujuw","in","","0","0","0","https://x.com/allenminheeku/status/1797789765045219635","1266571714932031491","allenminheeku"
"1796352335968637217","Fri May 31 01:25:46 +0000 2024","19","Udah kayak daftar pinjol cuma modal KTP bisa langsung gol Bisa dapet gaji setara manajer Pasti gajinya gak kepotong tapera Mentan : Menteri Setan https://t.co/jJcWEism6j","1796352335968637217","https://pbs.twimg.com/media/GO3s7C7aYAAY7k-.jpg","","in","Anseong-si, Republic of Korea","1","8","4","https://x.com/Kopipait__78/status/1796352335968637217","1236229061552140288","Kopipait__78"
"1796909120064512010","Sat Jun 01 14:18:13 +0000 2024","15","Masup ga jam segini? #zonauang","1796909120064512010","","","in","start 08:00 - sleep💤","0","0","0","https://x.com/bnrbgt/status/1796909120064512010","1616271314578460673","bnrbgt"
"1795648316300243437","Wed May 29 23:31:07 +0000 2024","5","@seekforjustices Ini modus udah sering banget dan gak ada kaitannya sm pinjol. Bbrp korban bahkan mau diajak vcs trus diancam mau disebarkan. Korban yg sdh pernah tfr akan diteror secara bertahap 1 pelaku vcs 2 (ngaku) wartawan 3 (ngaku) polisi Intinya mereka semua minta tebusan ...","1795961095410086361","","seekforjustices","in","Indonesia","0","2","2","https://x.com/iamagoodwife/status/1795961095410086361","742949451287961600","iamagoodwife"
"1797155807018316114","Sun Jun 02 06:38:28 +0000 2024","5","Orang lain pada iri sama Raffi Ahmad dan sekelasnya. Lah gue malah iri sama orang gila. Ga ada beban pikiran.","1797155807018316114","","","in","","0","1","3","https://x.com/SamaPinjol/status/1797155807018316114","1696363956007522304","SamaPinjol"
"1797083697671545095","Sun Jun 02 01:51:56 +0000 2024","2","Instagram dan facebook kan sama-sama dari meta. Tapi kenapa preferensi iklannya bisa beda. Di fb banyak banget iklan pinjol &amp; judol. Udah gw hide gw report ganti preferensi iklan gw tetep aja muncul. Tp kalau di ig bersih. Iklan paling ttg lifestyle musik baru tempat wisata","1797083697671545095","","","in","Indonesia","0","2","0","https://x.com/triiwidyan/status/1797083697671545095","410406372","triiwidyan"
"1797177226414485976","Sun Jun 02 08:03:35 +0000 2024","2","Dulu pas belum punya pinjol setiap gajian ngasih ortu tapi cuma lewat buat bayar utang mereka. Padahal pengen banget ngasih uang ke ortu tuh buat mereka seneng-seneng","1797177226414485976","","","in","","0","1","0","https://x.com/fidodhan/status/1797177226414485976","1777016652271661056","fidodhan"
"1798128284640952638","Tue Jun 04 23:02:45 +0000 2024","9","Aplikasi Sistem Informasi Data Pemilih (Sidalih) akan menjamin transparansi dan akurasi data pemilih. Transparansi data pemilih akan membangun kepercayaan masyarakat dan integritas penyelenggara pemilu. Bayar 2jt Mbappe Luhut Pinjol #Gajike13Cair Sumatera Innalillahi https://t.co/pkxiViLOel","1798128284640952638","https://pbs.twimg.com/media/GPQ8JUeawAAKNLs.jpg","","in","Indonesia","1","3","9","https://x.com/Anggita_lung/status/1798128284640952638","2907040202","Anggita_lung"
"1797929057138667524","Tue Jun 04 09:51:05 +0000 2024","9","Jadi makin optimis gue sama generasi emas 2045. Bayangkan uang BUMN digunakan seenak jidat buat keperluan pribadi dari pinjol deposito koperasi kartu kredit dan belanja foya-foya.","1797929057138667524","","","in","Indonesia","0","1","7","https://x.com/revolutia/status/1797929057138667524","14072986","revolutia"
"1798142031564546048","Tue Jun 04 23:57:22 +0000 2024","12","Sesungguhnya OPM ini gerombolan penjahat yang menginginkan Papua terpuruk OPM selalu menginginkan pertumpahan dar4h dan ingin masyarakat menderita. Mereka penjahat-penjahat kemanusiaan OPM wajib ditump4s #TumpasKSTPelanggarHAM Bayar 2jt Mbappe Luhut Pinjol https://t.co/pgFRtlmnz0","1798142031564546048","https://pbs.twimg.com/ext_tw_video_thumb/1798141881479827456/pu/img/BUWWbX0DKnpQzm8j.jpg","","in","Bandung, Indonesia","1","5","12","https://x.com/septixtang/status/1798142031564546048","1334156528174022659","septixtang"
"1798128194169839925","Tue Jun 04 23:02:23 +0000 2024","9","Warga Sipil yang Ditembak OPM di Puncak Jaya Bukan Anggota TNI Hoax sengaja disebar oleh OPM dan simpatisannya untuk menciptakan keresahan dan ketakutan serta mengganggu kondusifitas kehidupan masyarakat. ___ #TumpasKSTPelanggarHAM Bayar 2jt Mbappe Luhut Pinjol https://t.co/JQ2NJY9P6m","1798128194169839925","https://pbs.twimg.com/media/GPQ8Dx-bwAA0XrF.jpg","","in","East Java, Indonesia","0","2","6","https://x.com/Hansunriko/status/1798128194169839925","1349266626844061696","Hansunriko"
"1797608601927991347","Mon Jun 03 12:37:43 +0000 2024","2","Tapera ini tabungan bukan utang atau pajak Tapi kalau tidak nyetor akan ditagih dan ada sanksinya. Jadi kayak pinjol aja Yg namanya tabungan itu ya kalau ada duit sisa baru nyetor","1797608601927991347","","","in","Here & There ","0","0","3","https://x.com/SamSoegi/status/1797608601927991347","193991278","SamSoegi"
"1796364736206188991","Fri May 31 03:01:41 +0000 2024","4","@archivedbymat @cokolezatos @worksfess Saranku mending daftar sendiri aja prakerjanya daripada lewat orang nanti ada pencurian data buat galbay pinjol sendernya ","1796376475748499629","","archivedbymat","in","","0","0","0","https://x.com/Kingpirate007/status/1796376475748499629","1697806292495306752","Kingpirate007"
"1798026444792361406","Tue Jun 04 16:18:04 +0000 2024","11","Eh? Ini BUMN kok terjerat Pinjol? ","1798026444792361406","","","in","","0","2","4","https://x.com/_haye_/status/1798026444792361406","753553855","_haye_"
"1796437762670989427","Fri May 31 23:14:54 +0000 2024","4","@tirtaacademy @kadrunmampos Dosa aja ditebus harus nya utang pinjol juga sekalian..biar hidup makin afdol.","1796681793019765240","","tirtaacademy","in","","0","0","0","https://x.com/Noesa06/status/1796681793019765240","1597190996583862272","Noesa06"
"1795648316300243437","Wed May 29 13:03:06 +0000 2024","3","@rfdsdq itu orang emang modus buat meras sampeyan kemungkinan dia itu dc cuma minta tf lagi buat kepentingan pribadi so. berhati hatilah dalam bersosial media apalagi sampai pinjol","1795803050281713797","","seekforjustices","in","","0","1","0","https://x.com/Fahmiii221/status/1795803050281713797","1735242431891898368","Fahmiii221"
"1796554328490299649","Fri May 31 17:22:22 +0000 2024","167","@convomf pemerintahnya lagi mabok uang kekuasaan perampok tukang palak rakyatnya banyak yang gila tawuran warga klitih begal suporter bola pembunuhan pinjol..apalagi?? negara apa ini???!! https://t.co/4oq7YzWZcD","1796593073834897517","https://pbs.twimg.com/media/GO7H4UMboAELdxh.jpg","convomf","in","","1","0","16","https://x.com/situmejik/status/1796593073834897517","1315474206071517184","situmejik"
"1797993727904174468","Wed Jun 05 01:04:30 +0000 2024","2","@jokowi Pak ngurusin dulu masalah utama rakyat susah cari kerja gaji kecil pengeluaran besar pinjol judol merajalela. Bahkan ada yang makan pun susah. Bapak aja harus turun tangan untuk carikan kerjaan untuk dua putra Bapak yang pengangguran. Diluar sana masih jutaan yang nganggur Pak.","1798158924694339721","","jokowi","in","","0","0","0","https://x.com/Bumi39316/status/1798158924694339721","1748689927263715328","Bumi39316"
"1796916131212792077","Sat Jun 01 15:02:13 +0000 2024","16","@convomfs lo mirip kek temen gue sampe sekarang akhirnya terjebak toxic relationship mulu. gue berakhir gamau nasehatin lagi jadi semua risiko ditanggung dia mulai bayarin utang pinjol dimintain duit dianjing in diselingkuhin dikekang dll. temen lo bakal ada di posisi gw yg muak","1796920190892114012","","convomfs","in","","0","1","0","https://x.com/duniauli/status/1796920190892114012","1527641812424200193","duniauli"
"1796197370952311231","Thu May 30 15:09:59 +0000 2024","6","Hapus data pinjol backup data pinjol backup dc pinjol bisa atau tidak? Apakah hapus data backup data backup dc itu solusi? banyak sekali orang yang tergiur dengan jasa seperti itu karena orang tersebut sudah di hantui rasa takut kebingungan dan sudah cape membayar","1796197370952311231","","","in","Bandung, Jawa Barat","2","1","4","https://x.com/solusipinjoll/status/1796197370952311231","1382794203432853507","solusipinjoll"
"1798176269391245739","Wed Jun 05 02:13:25 +0000 2024","3","ʚɞ˚ ༘ ⋆｡˚ Siapa mau dibayarin pinjol dan paylaternya? Hari ini cuma tiga orang! Rosy bakal tuntun sampai selesai! ( ๑ ˃̵ᴗ˂̵)و trusted 300+ testimonials! https://t.co/tw7uPbf6DU ! ️ https://t.co/wTzyf9TfWP #ZonaUang #JokiPinjol #JokiGalbay","1798176269391245739","","","in","Trusted since 2017","1","0","28","https://x.com/pahtehtic/status/1798176269391245739","809266863096012800","pahtehtic"
"1795996599169998883","Thu May 30 01:52:11 +0000 2024","14","Calon peserta TAPERA... kumpuul Lihat keuntungan² program pemrentah iki... ojo soudzon... pemrentah kuwi sangat menolong rakyat e ... lebih baek rakyat utang ke pinjol ketimbang negoro utang teriliyunan ke negoro tetangga... maaallluuuu... maallluuuuuuu https://t.co/wmnSE33bjh","1795996599169998883","https://pbs.twimg.com/ext_tw_video_thumb/1795996463786561536/pu/img/LeLuiyZ-i5UPJTid.jpg","","in","lndonesia","2","3","2","https://x.com/Supriya77456669/status/1795996599169998883","1378891846676455425","Supriya77456669"
"1797532902143717823","Mon Jun 03 07:36:55 +0000 2024","9","Sedeket apapun lo sama temen lo mending gausah minjemin pinjol pake akun lo atau kreditin barang pake nama lo. Biar ga nyesel kaya gw. Niat bantu malah di jahatin temen sendiri ","1797532902143717823","","","in","","0","4","1","https://x.com/mas_ckrg/status/1797532902143717823","1739681678191378432","mas_ckrg"
"1797620870812459349","Mon Jun 03 13:26:28 +0000 2024","284","$1 | 15.000 IDR - 15 Hours Rt like &amp; reply Kamu ada tagihan spaylater spinjam akulaku kredivo dll? Mau jatuh tempo? Cape galob tulob? Coba konsul pinjol di @penjwual aja di bantu meringankan! Testi banyak fee diakhir 100% trusted! Buruan sebelum telat bayar","1797620870812459349","","","in","","1","313","307","https://x.com/VioPromotes/status/1797620870812459349","1604833423918759939","VioPromotes"
"1798208122713981389","Wed Jun 05 05:15:22 +0000 2024","11","@detikcom Iyya lah jok rumah 14 milyar dibayarin pake uang rakyat gimana gak nyenyak tidurnya yg gak nyenyak tuh rakyatmu yang kelilit pinjol dan judol tapi pemerintahnya nggak peduli.","1798222056431251684","","detikcom","in","","0","1","0","https://x.com/Oskar_Odding/status/1798222056431251684","2907385429","Oskar_Odding"
